{
  "$schema": "../evaluation-report.schema.json",
  "schemaVersion": "1.0.0",
  "dataClass": "synthetic-fixture",
  "queryFixtureSha256": "a2d3e2a04445918ef8ba793b8d5c9c37724f2004317a6cbf88638ccd4e3d65f8",
  "selection": { "status": "deferred", "selectedEngineId": null },
  "corpus": { "coreRecords": 4, "coastalRecords": 3, "overlapRecords": 1, "uniqueRecords": 6 },
  "engines": [
    { "engineId": "minisearch", "packageVersion": "7.2.0", "serializationVersion": "minisearch-json-v1", "deterministicBuild": true, "adapterEvidence": { "status": "passed", "command": "npm test -- src/search/evaluation", "sourceSha256": "889b84c89ebaf8b93c86e0728d5fd66cbbed31027772e34cf80156f0d89ea9d9" }, "quality": { "top1Accuracy": 1, "intendedTop5Rate": 1, "exactOrderRate": 1, "knownGapIds": ["synthetic-only"] }, "measurements": { "status": "not-measured", "rawDocumentBytes": null, "serializedIndexBytes": null, "compressedIndexBytes": null, "buildTimeMs": null, "initP50Ms": null, "initP95Ms": null, "initP99Ms": null, "queryP50Ms": null, "queryP95Ms": null, "queryP99Ms": null, "peakWorkerMemoryBytes": null } },
    { "engineId": "flexsearch", "packageVersion": "0.8.212", "serializationVersion": "flexsearch-export-v1", "deterministicBuild": true, "adapterEvidence": { "status": "passed", "command": "npm test -- src/search/evaluation", "sourceSha256": "889b84c89ebaf8b93c86e0728d5fd66cbbed31027772e34cf80156f0d89ea9d9" }, "quality": { "top1Accuracy": 1, "intendedTop5Rate": 1, "exactOrderRate": 1, "knownGapIds": ["synthetic-only"] }, "measurements": { "status": "not-measured", "rawDocumentBytes": null, "serializedIndexBytes": null, "compressedIndexBytes": null, "buildTimeMs": null, "initP50Ms": null, "initP95Ms": null, "initP99Ms": null, "queryP50Ms": null, "queryP95Ms": null, "queryP99Ms": null, "peakWorkerMemoryBytes": null } }
  ],
  "knownGaps": ["synthetic-only"]
}
